<?xml version="1.0"?>
<!--
Click nbfs://nbhost/SystemFileSystem/Templates/Licenses/license-default.txt to change this license
Click nbfs://nbhost/SystemFileSystem/Templates/XML/XmlSchema.xsd to edit this template
-->

<xs:schema version="1.0"
           xmlns:xs="http://www.w3.org/2001/XMLSchema"
           xmlns:tux="http://myGame/tux" 
           targetNamespace="http://myGame/tux"
           elementFormDefault="qualified">
    
<xs:include schemaLocation="dico.xsd"/>

   <!-- Racine : profil -->
    <xs:element name="profil" type="tux:Profil"/>
    <xs:complexType name="Profil">
        <xs:sequence>
            <xs:element name="nom" type="xs:string"/>
            <xs:element name="avatar" type="xs:string"/>
            <xs:element name="anniversaire" type="xs:date"/>
            <xs:element name="parties" type="tux:Parties"/>
        </xs:sequence>
    </xs:complexType>
    
    
    <!-- Type : Parties -->
    <xs:complexType name="Parties">
        <xs:sequence>
          <xs:element name="partie" type="tux:Partie" maxOccurs="unbounded" />
        </xs:sequence> 
    </xs:complexType>
    
    
    <!-- Type : Partie -->
    <xs:complexType name="Partie">
        <xs:sequence>
            <xs:element name="temps" type="tux:Temps"/>
            <xs:element name="niveau" type="tux:Niveau" />
        </xs:sequence>
        <xs:attribute name="date" type="xs:date"/>
        <xs:attribute name="trouvÃ©" type="xs:string" use="optional"/> 
    </xs:complexType>
    
    
     <!-- Type : Temps -->
    <xs:simpleType name="Temps">
        <xs:restriction base="xs:double">
             <xs:minInclusive value='0.0'/>
        </xs:restriction>
    </xs:simpleType>
    
    
</xs:schema>
